{
  "$schema": "https://json-schema.org/draft/2020-12/schema",
  "$id": "https://sandtable.davetashner.com/schema/decisions.schema.json",
  "title": "Sandtable decisions",
  "type": "array",
  "items": {
    "type": "object",
    "properties": {
      "id": {
        "type": "string",
        "pattern": "^[a-z0-9][a-z0-9-]*:[a-z0-9][a-z0-9._/-]*$",
        "description": "Qualified entity id, e.g. 1914:marne or person:joffre-joseph"
      },
      "at": {
        "type": "string",
        "format": "date-time",
        "pattern": "^(?:(?:\\d\\d[2468][048]|\\d\\d[13579][26]|\\d\\d0[48]|[02468][048]00|[13579][26]00)-02-29|\\d{4}-(?:(?:0[13578]|1[02])-(?:0[1-9]|[12]\\d|3[01])|(?:0[469]|11)-(?:0[1-9]|[12]\\d|30)|(?:02)-(?:0[1-9]|1\\d|2[0-8])))T(?:(?:[01]\\d|2[0-3]):[0-5]\\d(?::[0-5]\\d(?:\\.\\d+)?)?(?:Z|([+-](?:[01]\\d|2[0-3]):[0-5]\\d)))$",
        "description": "ISO-8601 date-time with offset, e.g. 1914-08-04T08:00:00Z"
      },
      "title": {
        "type": "string",
        "minLength": 1
      },
      "actor": {
        "description": "person:<slug> who had to choose",
        "type": "string",
        "pattern": "^[a-z0-9][a-z0-9-]*:[a-z0-9][a-z0-9._/-]*$"
      },
      "question": {
        "type": "string",
        "minLength": 1,
        "description": "Markdown"
      },
      "options": {
        "minItems": 2,
        "type": "array",
        "items": {
          "type": "object",
          "properties": {
            "id": {
              "type": "string",
              "pattern": "^[a-z0-9][a-z0-9-]*$"
            },
            "label": {
              "type": "string",
              "minLength": 1
            },
            "summary": {
              "type": "string",
              "minLength": 1,
              "description": "Markdown"
            },
            "branch": {
              "description": "Branch that plays out if this option is chosen",
              "type": "string",
              "pattern": "^[a-z0-9][a-z0-9-]*:[a-z0-9][a-z0-9._/-]*$"
            }
          },
          "required": [
            "id",
            "label",
            "summary"
          ],
          "additionalProperties": false
        }
      },
      "historical": {
        "type": "string",
        "pattern": "^[a-z0-9][a-z0-9-]*$",
        "description": "options[].id actually chosen"
      },
      "reasoning": {
        "type": "string",
        "minLength": 1,
        "description": "What was known at the time"
      },
      "verdict": {
        "type": "string",
        "minLength": 1,
        "description": "Outcome and the historians’ assessment"
      },
      "links": {
        "type": "object",
        "properties": {
          "people": {
            "type": "array",
            "items": {
              "type": "string",
              "pattern": "^[a-z0-9][a-z0-9-]*:[a-z0-9][a-z0-9._/-]*$",
              "description": "Qualified entity id, e.g. 1914:marne or person:joffre-joseph"
            }
          },
          "formations": {
            "type": "array",
            "items": {
              "type": "string",
              "pattern": "^[a-z0-9][a-z0-9-]*:[a-z0-9][a-z0-9._/-]*$",
              "description": "Qualified entity id, e.g. 1914:marne or person:joffre-joseph"
            }
          },
          "places": {
            "type": "array",
            "items": {
              "type": "string",
              "pattern": "^[a-z0-9][a-z0-9-]*:[a-z0-9][a-z0-9._/-]*$",
              "description": "Qualified entity id, e.g. 1914:marne or person:joffre-joseph"
            }
          },
          "events": {
            "type": "array",
            "items": {
              "type": "string",
              "pattern": "^[a-z0-9][a-z0-9-]*:[a-z0-9][a-z0-9._/-]*$",
              "description": "Qualified entity id, e.g. 1914:marne or person:joffre-joseph"
            }
          },
          "battles": {
            "type": "array",
            "items": {
              "type": "string",
              "pattern": "^[a-z0-9][a-z0-9-]*:[a-z0-9][a-z0-9._/-]*$",
              "description": "Qualified entity id, e.g. 1914:marne or person:joffre-joseph"
            }
          },
          "tech": {
            "type": "array",
            "items": {
              "type": "string",
              "pattern": "^[a-z0-9][a-z0-9-]*:[a-z0-9][a-z0-9._/-]*$",
              "description": "Qualified entity id, e.g. 1914:marne or person:joffre-joseph"
            }
          },
          "science": {
            "type": "array",
            "items": {
              "type": "string",
              "pattern": "^[a-z0-9][a-z0-9-]*:[a-z0-9][a-z0-9._/-]*$",
              "description": "Qualified entity id, e.g. 1914:marne or person:joffre-joseph"
            }
          },
          "documents": {
            "type": "array",
            "items": {
              "type": "string",
              "pattern": "^[a-z0-9][a-z0-9-]*:[a-z0-9][a-z0-9._/-]*$",
              "description": "Qualified entity id, e.g. 1914:marne or person:joffre-joseph"
            }
          },
          "casualties": {
            "type": "array",
            "items": {
              "type": "string",
              "pattern": "^[a-z0-9][a-z0-9-]*:[a-z0-9][a-z0-9._/-]*$",
              "description": "Qualified entity id, e.g. 1914:marne or person:joffre-joseph"
            }
          },
          "media": {
            "type": "array",
            "items": {
              "type": "string",
              "pattern": "^[a-z0-9][a-z0-9-]*:[a-z0-9][a-z0-9._/-]*$",
              "description": "Qualified entity id, e.g. 1914:marne or person:joffre-joseph"
            }
          }
        },
        "additionalProperties": false,
        "description": "Related entities by id; every id must resolve"
      },
      "sources": {
        "type": "array",
        "items": {
          "type": "object",
          "properties": {
            "source": {
              "type": "string",
              "pattern": "^[a-z0-9][a-z0-9-]*:[a-z0-9][a-z0-9._/-]*$",
              "description": "Source id, e.g. source:herwig-2009"
            },
            "pages": {
              "description": "Page(s), e.g. \"112–115\" or \"ch. 4\"",
              "type": "string"
            },
            "note": {
              "description": "What this citation supports",
              "type": "string"
            }
          },
          "required": [
            "source"
          ],
          "additionalProperties": false
        },
        "description": "Citations supporting the claims in this entity"
      }
    },
    "required": [
      "id",
      "at",
      "title",
      "question",
      "options",
      "historical",
      "reasoning",
      "verdict",
      "sources"
    ],
    "additionalProperties": false
  }
}
